"Headline","Link","Date","Content"
"คปภ. เร่งบูรณาการให้ความช่วยเหลือด้านประกันภัยอย่างเต็มที่ กรณี “รถบัสศึกษาดูงานประสบอุบัติเหตุ” มีผู้เสียชีวิต 18 ราย บาดเจ็บ 31 ราย ที่จังหวัดปราจีนบุรี","https://www.innwhy.com/oic260225/","2025-02-26","วันนี้ (26 กุมภาพันธ์ 2568) สำนักงานคณะกรรมการกำกับและส่งเสริมการประกอบธุรกิจประกันภัย (สำนักงาน คปภ.) โดยสายส่งเสริมและประกันภัยภูมิภาค สำนักงาน คปภ. ภาค 4 (นครราชสีมา) และสำนักงาน คปภ. จังหวัดนครนายกในฐานะเจ้าของพื้นที่รับผิดชอบได้ลงพื้นที่ทันทีเพื่อตรวจสอบ กรณีรถบัสโดยสารเดินทางเพื่อศึกษาดูงานของเทศบาลตำบลพรเจริญ อำเภอพรเจริญ จังหวัดบึงกาฬ เสียหลักพลิกค่ำบริเวณ 304 กม. 210+500 (ขาเข้า) ทางลงเขาศาลปู่โทน ตำบลบุพราหมณ์ อำเภอนาดี จังหวัดปราจีนบุรี เหตุเกิดเมื่อวันที่ 26 กุมภาพันธ์ 2568 โดยเบื้องต้นพบว่ามีผู้เสียชีวิต 18 ราย บาดเจ็บ 31 ราย พร้อมทั้งตรวจสอบข้อมูลการทำประกันภัย และติดตามรายงานความเสียหายอย่างเร่งด่วนผ่าน Platform การรายงานข้อมูลกรณีอุบัติภัยกลุ่มหรือรายใหญ่ด้วยระบบอิเล็กทรอนิกส์ รวมทั้งลงพื้นที่เพื่ออำนวยความสะดวกด้านประกันภัยให้กับครอบครัวของผู้ประสบภัยอย่างเต็มที่เพื่อให้ระบบประกันภัยช่วยบรรเทาความเดือดร้อนให้กับครอบครัวของผู้เสียชีวิตและผู้บาดเจ็บได้อย่างมีประสิทธิภาพและเป็นธรรม จากการลงพื้นที่ของสำนักงาน คปภ. จังหวัดนครนายก เบื้องต้นพบว่า รถบัสคันดังกล่าวทำประกันภัยรถภาคบังคับ (พ.ร.บ.) ไว้กับบริษัท มิตรแท้ประกันภัย จำกัด (มหาชน) โดยกรมธรรม์เริ่มคุ้มครองวันที่31 ธันวาคม 2567 และสิ้นสุดวันที่ 31 ธันวาคม 2568 ความคุ้มครองกรณีเสียชีวิต หรือทุพพลภาพถาวรสิ้นเชิง 500,000 บาทต่อคน กรณีบาดเจ็บค่ารักษาสูงสุดไม่เกิน 80,000 บาทต่อคน กรณีสูญเสียอวัยวะ 200,000-500,000 บาทต่อคน กรณีทุพพลภาพอย่างถาวร 300,000 บาทต่อคน และกรณีเข้ารักษาในสถานพยาบาลในฐานะคนไข้ในจะได้รับค่าชดเชยรายวัน 200 บาทต่อวัน รวมกันไม่เกิน 20 วัน นอกจากนี้รถบัสคันดังกล่าวยังได้ทำประกันภัยรถภาคสมัครใจ ประเภท 3 ไว้กับบริษัท มิตรแท้ประกันภัย จำกัด (มหาชน) กรมธรรม์เริ่มคุ้มครองวันที่ 31 ธันวาคม 2567 สิ้นสุดวันที่ 31 ธันวาคม 2568 ความคุ้มครองต่อความเสียหายต่อชีวิต ร่างกาย หรืออนามัยของบุคคลภายนอก 500,000 บาทต่อคน 10,000,000 บาทต่อครั้ง ความรับผิดต่อทรัพย์สิน 600,000 บาทต่อครั้ง รวมถึงความคุ้มครองอุบัติเหตุส่วนบุคคลตามเอกสารแนบท้ายกรมธรรม์ กรณีเสียชีวิต สูญเสียอวัยวะ ทุพพลภาพถาวรสิ้นของผู้ขับขี่ 50,000 บาท ผู้โดยสาร 43 คน ๆ ละ 50,000 บาทต่อคน และค่ารักษาพยาบาล 50,000 บาทต่อคน ประกันตัวผู้ขับขี่ 300,000 บาทต่อครั้ง สำหรับการติดตามค่าสินไหมทดแทนให้กับครอบครัวของผู้เสียชีวิตจากเหตุการณ์ครั้งนี้ เบื้องต้นอยู่ระหว่างการสืบสวนสอบสวนของพนักงานเจ้าหน้าที่ อย่างไรก็ตาม อุบัติเหตุครั้งนี้ ทายาทโดยธรรมของผู้ประสบอุบัติเหตุในกรณีที่เสียชีวิต จะได้รับค่าสินไหมทดแทนจากการทำประกันภัย พ.ร.บ. โดยเฉลี่ยจ่ายจากวงเงินไม่เกิน 10,000,000 บาทต่อครั้ง และประกันภัยรถภาคสมัครใจความคุ้มครองต่อความเสียหายต่อชีวิตร่างกายหรืออนามัยของบุคคลภายนอก โดยเฉลี่ยจ่ายวงเงินไม่เกิน 10,000,000 บาทต่อครั้ง ในส่วนของผู้บาดเจ็บที่รักษาตัวอยู่ที่โรงพยาบาลนั้น สำนักงาน คปภ. จังหวัดนครนายก ได้ประสานกับบริษัทประกันภัยเข้าไปอำนวยความสะดวกและรับรองสิทธิค่ารักษาพยาบาลกับโรงพยาบาลโดยตรง โดยผู้บาดเจ็บไม่ต้องสำรองจ่ายค่ารักษาตามสิทธิแต่อย่างใด นอกจากนี้สำนักงาน คปภ. ได้บูรณาการความร่วมกับสมาคมประกันชีวิตไทยและสมาคมประกันวินาศภัยไทย เพื่อตรวจสอบว่าผู้ประสบภัยหรือผู้เสียชีวิตในเหตุการณ์ครั้งนี้มีการทำประกันภัยเพิ่มเติมนอกเหนือจากนี้อีกหรือไม่ หากตรวจสอบพบว่ามีการทำประกันภัยก็จะได้รับสิทธิตามสัญญาประกันภัยที่ระบุไว้ทุกประการ สำนักงาน คปภ. ขอแสดงความเสียใจอย่างยิ่งกับครอบครัวของผู้บาดเจ็บและผู้เสียชีวิต และขอร่วมไว้อาลัยต่อเหตุการณ์อุบัติเหตุครั้งนี้ สำนักงาน คปภ. พร้อมอำนวยความสะดวกด้านประกันภัยอย่างเต็มที่ ทั้งนี้หากต้องการสอบถามข้อมูลเพิ่มเติมหรือไม่ได้รับความเป็นธรรมด้านประกันภัย ติดต่อสายด่วน คปภ. 1186 เพิ่มเราเป็นเพื่อนได้แล้ววันนี้!.... ทีมงาน INN WHY? รายการเพื่อผู้บริโภค ร่วมปฏิวัติความคิด ปรับเปลี่ยนชีวิต ก้าวสู่ความมั่นคง หลังเกษียณ ติดตามเราได้ที่ไลน์แอด @INNWHY.TV หรือ Facebook.com/INNWHY.TV และ Youtube.com/c/innwhyContact us : INNWHY31@gmail.com"
"พรูเด็นเชียล ประเทศไทย จับมือ โรงพยาบาลในเครือบางปะกอก ประกาศความร่วมมือ ยกระดับการบริการด้านสุขภาพให้กับลูกค้า","https://www.innwhy.com/prudential260225/","2025-02-26","พรูเด็นเชียล ประเทศไทย หนึ่งในผู้นำธุรกิจประกันชีวิต ร่วมมือกับโรงพยาบาลในเครือบางปะกอก ซึ่งเป็นโรงพยาบาลเอกชนชั้นนำของประเทศไทย ประกาศความร่วมมือเป็นพันธมิตรด้านการตลาด การส่งเสริมการขาย และบริการด้านสุขภาพ เพื่อยกระดับการมอบประสบการณ์ด้านบริการที่ดียิ่งขึ้นแก่ลูกค้า พร้อมตอกย้ำมาตรฐานการให้บริการด้านสุขภาพและสถานพยาบาลที่มุ่งสู่ความเป็นเลิศ นางสาวเปสลารี ธีระสาสน์ ประธานเจ้าหน้าที่บริหาร สายงานเทคโนโลยีและปฏิบัติการ บริษัท พรูเด็นเชียล ประกันชีวิต (ประเทศไทย) จำกัด (มหาชน) หรือ พรูเด็นเชียล ประเทศไทย กล่าวว่า “การจับมือร่วมกับโรงพยาบาลเครือบางปะกอกในครั้งนี้ ตอกย้ำความมุ่งมั่นในการสร้างเครือข่ายโรงพยาบาลพันธมิตรที่แข็งแกร่ง และมีคุณภาพสูงระดับโลก เพื่อให้ลูกค้าของเราได้รับประสบการณ์ด้านการบริการทางสุขภาพที่ดียิ่งขึ้น ไม่ว่าจะเป็นการดูแลสุขภาพเชิงป้องกันที่ดียิ่งขึ้น, การจัดแพ็กเกจตรวจสุขภาพราคาพิเศษ, การฉีดวัคซีน, โปรแกรมพัฒนาคุณภาพชีวิตและโปรแกรมพัฒนาด้านสุขภาพต่างๆ รวมถึงสิทธิพิเศษด้านสุขภาพอีกมากมายสำหรับลูกค้าพรูเด็นเชียลฯ ที่ใช้บริการจากเครือข่ายโรงพยาบาลบางปะกอกทั้ง 8 แห่งโดยเฉพาะ” ด้าน นพ.พณะ จันทรกมล ประธานเจ้าหน้าที่บริหารโรงพยาบาลในเครือบางปะกอก – ปิยะเวท กล่าวว่า “สำหรับการร่วมมือกันในครั้งนี้ระหว่าง โรงพยาบาลในเครือบางปะกอกและ พรูเด็นเชียล ประเทศไทย ซึ่งจะช่วยเสริมสร้างความแข็งแกร่งและยกระดับการบริการด้านสุขภาพให้แก่ลูกค้านั้น ทางโรงพยาบาลมีความพร้อมด้วยมาตรฐานสากล ศูนย์การแพทย์เฉพาะทางที่เป็นเลิศ หลากหลายสาขา ความเชี่ยวชาญทางการแพทย์แบบองค์รวม นวัตกรรมเทคโนโลยีการรักษา และการบริการสุขภาพที่ยอดเยี่ยมทุกระดับ แบบผสมผสานองค์รวม เพื่อมอบประสบการณ์ด้านการบริการสุขภาพที่ดีที่สุดให้แก่ลูกค้า” ทั้งนี้ โรงพยาบาลในเครือบางปะกอก ยังไม่หยุดยั้งและมีความมุ่งมั่นที่จะพัฒนาและเพิ่มศักยภาพในการรักษา และให้บริการอย่างต่อเนื่องเพื่อตอบสนองความต้องการของผู้รับบริการทุกท่านให้ปราศจากจากโรคภัยไข้เจ็บ และมีคุณภาพชีวิตที่ดีต่อไปในอนาคตอีกด้วย เพิ่มเราเป็นเพื่อนได้แล้ววันนี้!.... ทีมงาน INN WHY? รายการเพื่อผู้บริโภค ร่วมปฏิวัติความคิด ปรับเปลี่ยนชีวิต ก้าวสู่ความมั่นคง หลังเกษียณ ติดตามเราได้ที่ไลน์แอด @INNWHY.TV หรือ Facebook.com/INNWHY.TV และ Youtube.com/c/innwhyContact us : INNWHY31@gmail.com"
